{
  "comic_id": "the-mysterious-book-1-the-opening",
  "rubric_version": "1.0",
  "analyzed_pages": 25,
  "scores": {
    "growth_density_score": 4,
    "camera_dynamism_score": 3,
    "expression_intensity_score": 3,
    "story_structure_score": 2
  },
  "narrative_arc": "five friends + a guy hang out -> a glowing magic book materializes -> each person reads it in turn and muscle-grows (round-robin) -> growth escalates to peak nudity/strain across a gym session -> scene resets to an apartment, more reading + arguing -> the book yields a golden gauntlet artifact -> two women power up in a glowing climax -> they emerge as caped red-and-white muscle-heroes and fly off (to be continued)",
  "pages": [
    {
      "page": 1,
      "role": "cover",
      "growth_state": "none",
      "panel_count": 1,
      "panels": [
        {
          "n": 1,
          "shot_distance": "MS",
          "angle": "low",
          "staging": ["scale-contrast", "depth-fg-bg", "low-hero"],
          "expression": "awe",
          "expression_intensity": 4,
          "growth_focus": false,
          "body_part_focus": "none",
          "sfx": [],
          "notes": "Title cover: three women reach up toward a glowing floating book; low angle, radiant FG book vs smaller bodies receding below. Title logo + 'Art by Boogie / Story by Cribble / GrowGetterComics.com'."
        }
      ],
      "page_notes": "distance_spread=1; flat_panel_count=0; strong reaching-upward composition, clear promise = the book causes something. No growth yet."
    },
    {
      "page": 2,
      "role": "setup",
      "growth_state": "none",
      "panel_count": 4,
      "panels": [
        {
          "n": 1,
          "shot_distance": "WS",
          "angle": "eye",
          "staging": ["depth-fg-bg", "scale-contrast"],
          "expression": "joy",
          "expression_intensity": 2,
          "growth_focus": false,
          "body_part_focus": "none",
          "sfx": [],
          "notes": "Establishing living room: bearded guy in FG left (larger), four women on the couch in BG. Good depth, lots of empty dialogue balloons."
        },
        {
          "n": 2,
          "shot_distance": "MS",
          "angle": "eye",
          "staging": ["flat-level"],
          "expression": "joy",
          "expression_intensity": 2,
          "growth_focus": false,
          "body_part_focus": "face",
          "sfx": [],
          "notes": "Three women lean in, chatting; level eyeline, casual."
        },
        {
          "n": 3,
          "shot_distance": "MS",
          "angle": "eye",
          "staging": ["flat-level"],
          "expression": "neutral",
          "expression_intensity": 2,
          "growth_focus": false,
          "body_part_focus": "face",
          "sfx": [],
          "notes": "Trio seated, talking; flat row of heads."
        },
        {
          "n": 4,
          "shot_distance": "MS",
          "angle": "eye",
          "staging": ["flat-level"],
          "expression": "neutral",
          "expression_intensity": 2,
          "growth_focus": false,
          "body_part_focus": "face",
          "sfx": [],
          "notes": "Near-repeat of panel 3 from a hair-different angle; conversation, no camera movement."
        }
      ],
      "page_notes": "distance_spread=2; flat_panel_count=3; pure setup. Panels 2-4 are a flat-level conversation block with empty balloons (lettering stripped from source)."
    },
    {
      "page": 3,
      "role": "buildup",
      "growth_state": "trigger",
      "panel_count": 5,
      "panels": [
        {
          "n": 1,
          "shot_distance": "MS",
          "angle": "eye",
          "staging": ["flat-level", "scale-contrast"],
          "expression": "shock",
          "expression_intensity": 3,
          "growth_focus": false,
          "body_part_focus": "face",
          "sfx": ["SHIING!"],
          "notes": "A bright light/portal blooms upper right (SHIING!), women turn toward it. The catalyst arrives."
        },
        {
          "n": 2,
          "shot_distance": "MLS",
          "angle": "eye",
          "staging": ["depth-fg-bg"],
          "expression": "shock",
          "expression_intensity": 3,
          "growth_focus": false,
          "body_part_focus": "none",
          "sfx": [],
          "notes": "The glowing book has materialized standing on a surface, FG right; women recoil on couch BG."
        },
        {
          "n": 3,
          "shot_distance": "WS",
          "angle": "high",
          "staging": ["depth-fg-bg", "high-vuln"],
          "expression": "shock",
          "expression_intensity": 3,
          "growth_focus": false,
          "body_part_focus": "none",
          "sfx": [],
          "notes": "High wide of the group clustered, looking at the now-closed book on the floor across the room. Good use of high angle for the 'what is that' beat."
        },
        {
          "n": 4,
          "shot_distance": "MS",
          "angle": "eye",
          "staging": ["flat-level"],
          "expression": "fear",
          "expression_intensity": 2,
          "growth_focus": false,
          "body_part_focus": "face",
          "sfx": [],
          "notes": "Three women react, leaning together."
        },
        {
          "n": 5,
          "shot_distance": "CU",
          "angle": "eye",
          "staging": ["depth-fg-bg"],
          "expression": "awe",
          "expression_intensity": 3,
          "growth_focus": false,
          "body_part_focus": "face",
          "sfx": [],
          "notes": "Blonde CU holding the book, awed/curious. Nice push-in to close the page on the person who'll read first."
        }
      ],
      "page_notes": "distance_spread=4 (MS/MLS/WS/CU); flat_panel_count=2; the trigger page. SHIING! sells the magical arrival; closing CU on the blonde sets up the first reader. Counts toward growth ratio (trigger)."
    },
    {
      "page": 4,
      "role": "buildup",
      "growth_state": "none",
      "panel_count": 4,
      "panels": [
        {
          "n": 1,
          "shot_distance": "MS",
          "angle": "eye",
          "staging": ["depth-fg-bg", "scale-contrast"],
          "expression": "curiosity",
          "expression_intensity": 2,
          "growth_focus": false,
          "body_part_focus": "none",
          "sfx": ["Swipe!"],
          "notes": "Book passed/grabbed across frame, motion arc + 'Swipe!'. Three women staged left-to-right at varied distances."
        },
        {
          "n": 2,
          "shot_distance": "MLS",
          "angle": "eye",
          "staging": ["flat-level"],
          "expression": "joy",
          "expression_intensity": 3,
          "growth_focus": false,
          "body_part_focus": "none",
          "sfx": [],
          "notes": "Black-haired woman in teal opens the book, reading aloud; standing, pleased."
        },
        {
          "n": 3,
          "shot_distance": "MS",
          "angle": "eye",
          "staging": ["scale-contrast", "OTS"],
          "expression": "determination",
          "expression_intensity": 3,
          "growth_focus": false,
          "body_part_focus": "face",
          "sfx": [],
          "notes": "Reader centered holding the open book toward camera, two friends framing her at smaller scale behind. Good big-FG / smaller-others staging."
        },
        {
          "n": 4,
          "shot_distance": "MS",
          "angle": "eye",
          "staging": ["flat-level"],
          "expression": "neutral",
          "expression_intensity": 2,
          "growth_focus": false,
          "body_part_focus": "face",
          "sfx": [],
          "notes": "Trio with the book between them, talking; flat row."
        }
      ],
      "page_notes": "distance_spread=2; flat_panel_count=2; buildup, the reading begins but no body change yet, so growth_state=none. Panel 3 is a clean scale-contrast composition worth noting."
    },
    {
      "page": 5,
      "role": "active-growth",
      "growth_state": "early",
      "panel_count": 5,
      "panels": [
        {
          "n": 1,
          "shot_distance": "MS",
          "angle": "eye",
          "staging": ["depth-fg-bg"],
          "expression": "shock",
          "expression_intensity": 3,
          "growth_focus": false,
          "body_part_focus": "none",
          "sfx": ["KRETHUNK!"],
          "notes": "Book slams open/down on table (KRETHUNK!), FG left; reaction in BG."
        },
        {
          "n": 2,
          "shot_distance": "MCU",
          "angle": "low",
          "staging": ["low-hero"],
          "expression": "ecstasy",
          "expression_intensity": 4,
          "growth_focus": true,
          "body_part_focus": "chest",
          "sfx": [],
          "notes": "First transformation onset: teal-hoodie woman tips head back, chest beginning to swell; low angle. Strong head-back ecstasy face sells the start."
        },
        {
          "n": 3,
          "shot_distance": "MS",
          "angle": "eye",
          "staging": ["scale-contrast"],
          "expression": "shock",
          "expression_intensity": 4,
          "growth_focus": true,
          "body_part_focus": "chest",
          "sfx": [],
          "notes": "She throws arms up as chest/torso expands; two friends recoil at smaller scale, radiating motion lines. Good scale-contrast + onlooker reactions."
        },
        {
          "n": 4,
          "shot_distance": "MS",
          "angle": "eye",
          "staging": ["diagonal"],
          "expression": "awe",
          "expression_intensity": 3,
          "growth_focus": true,
          "body_part_focus": "arms",
          "sfx": [],
          "notes": "She flexes a bicep; friend reacts on a diagonal axis across frame."
        },
        {
          "n": 5,
          "shot_distance": "MS",
          "angle": "eye",
          "staging": ["scale-contrast", "diagonal"],
          "expression": "shock",
          "expression_intensity": 3,